{
  "schemaVersion": "1.0.0",
  "credentialId": "0193b2a0-0000-7000-8000-000000001101",
  "athleteId": "0193b2a0-0000-7000-8000-000000000001",
  "version": 2,
  "kind": "GARMIN_PERSONAL_API_KEY",
  "handle": "garmin_personal_api_key/0193b2a0-0000-7000-8000-000000000001",
  "createdAt": "2026-10-25T10:00:00Z",
  "rotatedAt": "2026-11-20T09:30:00Z",
  "expiresOn": "2027-01-23"
}
